Job Title,Company Name,Experience Required,Job Type,Job Description,Days Ago,Job URL
Data Scientist,Centre for Integrative Omics Data Science (CIODS),1 to 5 Yrs,Full time,"The ideal candidate's favourite words are learning, data, scale, and agility. You will leverage your strong collaboration skills and ability to extract valuable insights from highly complex data sets to ask the right questions and find the correct answers.

Responsibilities
 Analyze raw data: assessing quality, cleansing, and structuring for downstream processing.
 Design accurate and scalable prediction algorithms.
 Molecular Docking and Simulation.
 Integrating Biological Data.
 Computational Biology related works.

Qualifications
 Bachelor's degree or equivalent experience in a quantitative field (Bio-informatics, Biotechnology, Statistics, Computer Science, Engineering, etc.)
 At least 1 - 2 years of experience in quantitative analytics or data modelling
 Freshers can also apply.*
 Deep understanding of predictive modelling, machine learning, clustering and classification techniques, and algorithms
 Fluency in a programming language (Python, R, C, C++, Java, SQL),",5,https://www.shine.com/jobs/data-scientist/centre-for-integrative-omics-data-science-ciods/16515992
Data Scientist,APPLIED CLOUD COMPUTING PRIVATE LIMITED,3 to 6 Yrs,Full time,"Skill set- Python, Maching learning algorithm, Predictive Modeling, Logistic & Linear Regression, Xgboost, GBM etc. 
Good to have: Pyspark, flaskapi /fastapi, AWS Lamda, Fargate/ECS, Sage maker, SES, SNS, ec2, CloudWatch etc.
Database: SQL Basics
Also required hands on experience into Classification, Regression problems using Decision trees, Boosting algorithms- GBM/xgboost.
 
Bagging-random Forest, linear and logistic regression, Storytelling, hypothesis testing, data analysis and data visualization etc. 
 NOTE: Please note that Immediate to 25 Days' notice period can consider for this role.  Skill set- Python,  Maching learning algorithm, Predictive Modeling, Logistic & Linear Regression, Xgboost, GBM etc.  Good to have: Pyspark, flaskapi /fastapi, AWS Lamda, Fargate/ECS, Sage maker, SES, SNS, ec2, CloudWatch etc. Database: SQL Basics Also required hands on experience into Classification, Regression problems using Decision trees, Boosting algorithms- GBM/xgboost. Bagging-random Forest, linear and logistic regression, Storytelling, hypothesis testing, data analysis and data visualization etc.",3,https://www.shine.com/jobs/data-scientist/applied-cloud-computing-private-limited/16526408
Data Science Lead,One,12 to 16 Yrs,Full time,"About One

Ones mission is simple - to help customers achieve financial progress. Were doing this by creating simple solutions to help our customers save, spend, borrow, and grow their money  all in one place.

The U.S. consumer today deserves better. Millions of Americans today cant access credit, build savings or wealth, and are left to manage their financial lives through multiple disconnected apps. Almost a quarter of U.S. adults are unbanked or underbanked and roughly 80% of fintech users rely on multiple accounts to manage their finances.

What makes us unique  We are backed by a preeminent fintech investor (Ribbit) and the worlds largest retailer (Walmart), maintain the speed and independence of a startup, and employ a strong (and growing) collection of world-class talent.

Theres never been a better moment to build a business that helps people achieve financial progress. Come build with us!

The Role

We are looking for an analytics/data science leader to lead our team of data scientists and analysts who are responsible for building AI/ML models for managing fraud and credit risk and driving a customer level profitability framework across all ONE product offerings. You will be part of the Risk leadership team and work closely with senior leadership, product managers, engineers, and business stakeholders to deliver best in class modeling solutions that optimizes risk based returns across customer lifecycle.

This Role Is Responsible For
 Lead, mentor, and grow a team of data scientists and modelers who work on modeling projects that span across customer life cycle of onboarding, underwriting, existing customer management, retention, attrition, product cross sell and upsell, line management and collection strategies.
 Define and execute the roadmap for Risk data science projects and initiatives that align with our business goals and priorities.
 Oversee the end-to-end lifecycle of data science projects, from problem definition, data collection and processing, model development and evaluation, to deployment and monitoring.
 Establish best practices and standards for data science methodologies, tools, frameworks, and processes across the organization.
 Collaborate with cross-functional teams to understand their modeling needs and requirements, and provide guidance and support on data-related matters.
 Communicate effectively with senior executives and stakeholders on the value proposition, impact, and insights of data science solutions.
 Stay abreast of the latest developments and trends in data science, fintech, and related domains, and identify new opportunities and challenges for data science innovation.

You Bring
 English Proficiency Writing and Speaking
 Masters or PhD degree in Computer Science, Statistics, Mathematics, Engineering, or related field.
 12+ years of experience in data science, data analytics, machine learning, or related roles in a data driven organization preferably in the fintech or financial services industry.
 Proven track record of leading and managing high-performing data science teams and delivering successful data science projects and products.
 Expertise in applying various data science techniques and algorithms to solve complex business problems using large-scale datasets.
 Proficiency in using Python, R, SQL, or other programming languages for data analysis and modeling.
 Strong business acumen and domain knowledge in the fintech or financial services industry.
 Excellent communication, presentation, and interpersonal skills.

What its like working @ One
 Competitive cash
 Benefits effective on day one
 Early access to a high-potential, high-growth fintech
 Generous stock option packages in an early-stage startup
 Employer Provident Fund contributions
 Comprehensive health insurance for you and your family (health insurance, accident and disability insurance, term life insurance), including mental health support and wellness programs
 Flexible time off programs  vacation, sick and other paid leaves and paid regional holidays
 Monthly transport allowance over and above fixed cash for office commutes
 Monthly work-from-home stipend over and above fixed cash for internet and utilities
 Hybrid working model  work with our team in Bengaluru three times a week

Leveling Philosophy

In order to thoughtfully scale the company and avoid downstream inequities, weve adopted a flat titling structure at One. Though we may occasionally post a role externally with a prefix such as Senior to reflect the external level of the position, we do not use prefixes in titles like that internally unless in a position which manages a team. Internal titles typically include your specific functional responsibility, such as engineering, product management or sales, and often include additional descriptors to ensure clarity of role and placement within our organization (i.e. Engineer, Platform, Sales, Business Development or Manager, Talent). Employees are paid commensurate with their experience and the internal level within One.

Inclusion & Belonging
,",6,https://www.shine.com/jobs/data-science-lead/one/16513092
Anaplan Data AI | Sr AI Data Scientist IRC238170,Hitachi Careers,10 to 14 Yrs,Full time,"Description:

Job Overview:

Seeking an innovative and skilled AI Data Scientist to join our dynamic team. In this role, you will be responsible for leveraging data and advanced algorithms to drive AI initiatives, build machine learning models, and provide actionable insights that contribute to the company's strategic goals. You will work closely with cross-functional teams to deliver data-driven solutions that enhance our products and services.

Education: Master's degree or Ph.D. in Data Science, Computer Science, Statistics, Mathematics, or a related field.

Experience: 10 plus years of experience in data science, analytics, and machine learning.

Technical Expertise:

Proficiency in programming languages such as Python, R, or SQL.
Strong understanding of machine learning algorithms, statistical modeling, and data mining techniques.
Experience with data visualization tools (e.g., Tableau, Power BI, Matplotlib).
Knowledge of big data technologies (e.g., Hadoop, Spark) and cloud platforms (AWS, Google Cloud).
Familiarity with database systems, both relational and NoSQL.
Soft Skills:

Excellent problem-solving and analytical skills.
Strong communication and collaboration skills.
Ability to explain complex technical concepts to non-technical stakeholders.
Strong project management and organizational skills.

Required Skills:

Proficiency in programming languages such as Python, R, or SQL.
Strong understanding of machine learning algorithms, statistical modeling, and data mining techniques.
Experience with data visualization tools (e.g., Tableau, Power BI, Matplotlib).
Knowledge of big data technologies (e.g., Hadoop, Spark) and cloud platforms (AWS, Azure, Google Cloud).
Familiarity with database systems, both relational and NoSQL.
Excellent problem-solving and analytical skills.
Strong communication and collaboration skills.
Ability to explain complex technical concepts to non-technical stakeholders.
Strong project management and organizational skills.
Experience with Agile methodologies and software development lifecycle.
Proven ability to deliver data-driven insights and solutions.
Experience in leading data science projects and teams.

Other Requirements:

Experience with Agile methodologies and software development lifecycle.
Proven ability to deliver data-driven insights and solutions.
Experience in leading data science projects and teams.

Requirements:

Job Overview:

Seeking an innovative and skilled AI Data Scientist to join our dynamic team. In this role, you will be responsible for leveraging data and advanced algorithms to drive AI initiatives, build machine learning models, and provide actionable insights that contribute to the company's strategic goals. You will work closely with cross-functional teams to deliver data-driven solutions that enhance our products and services.

Education: Master's degree or Ph.D. in Data Science, Computer Science, Statistics, Mathematics, or a related field.

Experience: 10 plus years of experience in data science, analytics, and machine learning.

Technical Expertise:
 Proficiency in programming languages such as Python, R, or SQL.
 Strong understanding of machine learning algorithms, statistical modeling, and data mining techniques.
 Experience with data visualization tools (e.g., Tableau, Power BI, Matplotlib).
 Knowledge of big data technologies (e.g., Hadoop, Spark) and cloud platforms (AWS, Google Cloud).
 Familiarity with database systems, both relational and NoSQL.

Soft Skills:
 Excellent problem-solving and analytical skills.
 Strong communication and collaboration skills.
 Ability to explain complex technical concepts to non-technical stakeholders.
 Strong project management and organizational skills.

Required Skills:
 Proficiency in programming languages such as Python, R, or SQL.
 Strong understanding of machine learning algorithms, statistical modeling, and data mining techniques.
 Experience with data visualization tools (e.g., Tableau, Power BI, Matplotlib).
 Knowledge of big data technologies (e.g., Hadoop, Spark) and cloud platforms (AWS, Azure, Google Cloud).
 Familiarity with database systems, both relational and NoSQL.
 Excellent problem-solving and analytical skills.
 Strong communication and collaboration skills.
 Ability to explain complex technical concepts to non-technical stakeholders.
 Strong project management and organizational skills.
 Experience with Agile methodologies and software development lifecycle.
 Proven ability to deliver data-driven insights and solutions.
 Experience in leading data science projects and teams.

Other Requirements:
 Experience with Agile methodologies and software development lifecycle.
 Proven ability to deliver data-driven insights and solutions.
 Experience in leading data science projects and teams.

Job Responsibilities:

Data Analysis:

Collect, clean, and preprocess data from various sources.
Perform exploratory data analysis to uncover patterns, correlations, and insights.
Develop and implement statistical models and machine learning algorithms to solve business problems.

Model Development:
Design, build, and validate predictive models and machine learning solutions.
Optimize model performance through parameter tuning and feature engineering.
Implement and deploy machine learning models in production environments.

Data Visualization:
Create compelling data visualizations to communicate insights and findings.
Develop dashboards and reports to monitor key metrics and performance indicators.
Present data-driven recommendations to stakeholders and decision-makers.

Collaboration:
Work closely with cross-functional teams, including data engineers, software developers, and business analysts.
Collaborate with stakeholders to understand business requirements and objectives.
Provide technical guidance and mentorship to junior data scientists and team members.

Continuous Improvement:
Stay updated with industry trends, tools, and best practices in data science and machine learning.
Evaluate new tools and technologies to improve data analysis and model development processes.
Drive initiatives for continuous improvement and innovation in data science practices.

What We Offer

Exciting Projects: We focus on industries like High-Tech, communication, media, healthcare, retail and telecom. Our customer list is full of fantastic global brands and leaders who love what we build for them.

Collaborative Environment: You Can expand your skills by collaborating with a diverse team of highly talented people in an open, laidback environment - or even abroad in one of our global centers or client facilities!

Work-Life Balance: GlobalLogic prioritizes work-life balance, which is why we offer flexible work schedules, opportunities to work from home, and paid time off and holidays.

Professional Development: Our dedicated Learning & Development team regularly organizes Communication skills training(GL Vantage, Toast Master),Stress Management program, professional certifications, and technical and soft skill trainings.

Excellent Benefits: We provide our employees with competitive salaries, family medical insurance, Group Term Life Insurance, Group Personal Accident Insurance , NPS(National Pension Scheme ), Periodic health awareness program, extended maternity leave, annual performance bonuses, and referral bonuses.

Fun Perks: We want you to love where you work, which is why we host sports events, cultural activities, offer food on subsidies rates, Corporate parties. Our vibrant offices also include dedicated GL Zones, rooftop decks and GL Club where you can drink coffee or tea with your colleagues over a game of table and offer discounts for popular stores and restaurants!

About GlobalLogic

GlobalLogic is a leader in digital engineering. We help brands across the globe design and build innovative products, platforms, and digital experiences for the modern world.

By integrating experience design, complex engineering, and data expertise-we help our clients imagine what's possible, and accelerate their transition into tomorrow's digital businesses.

Headquartered in Silicon Valley, GlobalLogic operates design studios and engineering centers around the world, extending our deep expertise to customers in the automotive, communications, financial services, healthcare and life sciences, manufacturing, media and entertainment, semiconductor, and technology industries.

GlobalLogic is a Hitachi Group Company operating under Hitachi, Ltd. (TSE: 6501) which contributes to a sustainable society with a higher quality of life by driving innovation through data and technology as the Social Innovation Business.,",6,https://www.shine.com/jobs/anaplan-data-ai-sr-ai-data-scientist-irc/hitachi-careers/16506051
Data Scientist - Computer Vision,Esri,1 to 5 Yrs,Full time,"Overview

Esri is the world leader in geographic information systems (GIS) and developer of ArcGIS, the leading mapping and analytics software used in 75 percent of Fortune 500 companies. At the Esri R&D Center-New Delhi, we are applying cutting-edge AI and deep learning techniques to revolutionize geospatial analysis and derive insight from imagery and location data. We are passionate about applying data science and artificial intelligence to solve some of the worlds biggest challenges.

Our team develops tools, APIs, and AI models for geospatial analysts and data scientists, enabling them to leverage the latest research in spatial data science, AI and geospatial deep learning.

As a Data Scientist, you will develop deep learning models using libraries such as PyTorch and create APIs and tools for training and deploying them on satellite imagery. If you are passionate about deep learning applied to remote sensing and GIS, developing AI and deep learning models, and love maps or geospatial datasets/imagery, this is the place to be!

Responsibilities
 Develop tools, APIs and pretrained models for geospatial AI
 Integrate ArcGIS with popular deep learning libraries such as PyTorch
 Develop APIs and model architectures for computer vision and deep learning applied to geospatial imagery
 Author and maintain geospatial data science samples using ArcGIS and machine learning/deep learning libraries
 Curate and pre/post-process data for deep learning models and transform it into geospatial information
 Perform comparative studies of various deep learning model architectures

Requirements
 1-5 years of experience with Python, in data science and deep learning
 Self-learner with coursework in and extensive knowledge of machine learning and deep learning
 Experience with Python machine learning and deep learning libraries such as PyTorch, Scikit-learn, NumPy, Pandas
 Expertise in one or more of the following areas:
 Traditional and deep learning-based computer vision techniques with the ability to develop deep learning models for computer vision tasks (image classification, object detection, semantic and instance segmentation, GANs, super-resolution, image inpainting, and more)
 Convolutional neural networks such as VGG, ResNet, Faster R-CNN, Mask R-CNN, and others
 Transformer models applied to computer vision
 Expertise in 3D deep learning with Point Clouds, meshes, or Voxels with the ability to develop 3D geospatial deep learning models, such as PointCNN, MeshCNN, and more
 Experience in data visualization in Jupyter Notebooks using matplotlib and other libraries
 Experience with hyperparameter-tuning and training models to a high level of accuracy
 Bachelor's in computer science, engineering, or related disciplines from IITs and other top-tier engineering colleges
 Existing work authorization for India

Recommended Qualifications
 Experience applying deep learning to satellite or medical imagery or geospatial datasets
 Familiarity with ArcGIS suite of products and concepts of GIS

About Esri

At Esri, diversity is more than just a word on a map. When employees of different experiences, perspectives, backgrounds, and cultures come together, we are more innovative and ultimately a better place to work. We believe in having a diverse workforce that is unified under our mission of creating positive global change. We understand that diversity, equity, and inclusion is not a destination but an ongoing process. We are committed to the continuation of learning, growing, and changing our workplace so every employee can contribute to their lifes best work. Our commitment to these principles extends to the global communities we serve by creating positive change with GIS technology. For more information on Esris Racial Equity and Social Justice initiatives, please visit our website here.

If you dont meet all of the preferred qualifications for this position, we encourage you to still apply!


Esri Privacy Esri takes our responsibility to protect your privacy seriously. We are committed to respecting your privacy by providing transparency in how we acquire and use your information, giving you control of your information and preferences, and holding ourselves to the highest national and international standards, including CCPA and GDPR compliance.,",6,https://www.shine.com/jobs/data-scientist-computer-vision/esri/16512454
