Job Title,Company Name,Experience Required,Job Type,Job Description,Days Ago,Job URL
Oliver Wyman - Data Scientist - Data and Analytics (DNA ...,Mercer,0 to 15 Yrs,Full time,"Who We Are 

Oliver Wyman is a global leader in management consulting. With offices 70 cities across 30 countries, Oliver Wyman combines deep industry knowledge with specialized expertise in strategy, finance, operations, technology, risk management, and organizational transformation.

Our 6000+ professionals help clients optimize their business, improve their IT, operations, and risk profile, and accelerate their organizational performance to seize the most attractive opportunities. Our professionals see what others don't, challenge conventional thinking, and consistently deliver innovative, customized solutions. As a result, we have a tangible impact on clients top and bottom lines. Our clients are the CEOs and executive teams of the top global 1000 companies.

Oliver Wyman is a business of Marsh McLennan [NYSE: MMC]

For more information, visit www.oliverwyman.com

Follow Oliver Wyman on Twitter @OliverWyman

Practice Overview

Practice: Data and Analytics (DNA) - Analytics Consulting

Location: Gurugram, India

At Oliver Wyman DNA, we partner with clients to solve tough strategic business challenges with the power of analytics, technology, and industry expertise. We drive digital transformation, create customer-focused solutions, and optimize operations for the future. Our goal is to achieve lasting results in collaboration with our clients and stakeholders. We value and offer opportunities for personal and professional growth. Join our entrepreneurial team focused on delivering impact globally.

Our Mission and Purpose

Mission: Leverage Indias high-quality talent to provide exceptional analytics-driven management consulting services that empower clients globally to achieve their business goals and drive sustainable growth, by working alongside Oliver Wyman consulting teams.

Purpose: Our purpose is to bring together a diverse team of highest-quality talent, equipped with innovative analytical tools and techniques to deliver insights that drive meaningful impact for our global client base. We strive to build long-lasting partnerships with clients based on trust, mutual respect, and a commitment to deliver results.

We aim to build a dynamic and inclusive organization that attracts and retains the top analytics talent in India and provides opportunities for professional growth and development. Our goal is to provide a sustainable work environment while fostering a culture of innovation and continuous learning for our team members.

The Role and Responsibilities

We have open positions ranging from Associate Data Scientist to Director, providing talented and motivated professionals with excellent career and growth opportunities. We seek individuals with relevant prior experience in quantitatively intense areas to join our team. Youll be working with varied and diverse teams to deliver unique and unprecedented solutions across all industries.

In the data scientist track, you will be primarily responsible for managing and delivering analytics projects and helping teams design analytics solutions and models that consistently drive scalable high-quality solutions.

Your responsibilities will include
 Working alongside Oliver Wyman consulting teams and partners, engaging directly with global clients to understand their business challenges
 Exploring large-scale data and crafting models to answer core business problems
 Working with partners and principals to shape proposals that showcase our data science and analytics capabilities
 Explaining, refining, and crafting model insights and architecture to guide stakeholders through the journey of model building
 Advocating best practices in modelling and code hygiene
 Leading the development of proprietary statistical techniques, ML algorithms, assets, and analytical tools on varied projects
 Travelling to clients locations across the globe, when required, understanding their problems, and delivering appropriate solutions in collaboration with them
 Keeping up with emerging state-of-the-art modelling and data science techniques in your domain

Your Attributes, Experience & Qualifications
 Bachelor's or Masters degree in a quantitative discipline from a top academic program (Data Science, Mathematics, Statistics, Computer Science, Informatics, and Engineering)
 Prior experience in data science, machine learning, and analytics
 Passion for problem-solving through big-data and analytics
 Pragmatic and methodical approach to solutions and delivery with a focus on impact
 Independent worker with the ability to manage workload and meet deadlines in a fast-paced environment
 Impactful presentation skills that succinctly and efficiently convey findings, results, strategic insights, and implications
 Excellent verbal and written communication skills and complete command of English
 Willingness to travel
 Collaborative team player
 Respect for confidentiality

Technical Background
 Proficiency in modern programming languages (Python is mandatory; SQL, R, SAS desired) and machine learning frameworks (e.g., Scikit-Learn, TensorFlow, Keras/Theano, Torch, Caffe, MxNet)
 Prior experience in designing and deploying large-scale technical solutions leveraging analytics
 Solid foundational knowledge of the mathematical and statistical principles of data science
 Familiarity with cloud storage, handling big data, and computational frameworks
 Valued but not required:

o Compelling side projects or contributions to the Open-Source community

o Experience presenting at data science conferences and connections within the data science community

o Interest/background in Financial Services in particular, as well as other sectors where Oliver Wyman has a strategic presence

Interview Process

The application process will include testing technical proficiency, case study, and team-fit interviews. Please include a brief note introducing yourself, what youre looking for when applying for the role, and your potential value-add to our team.

Roles and levels

We are hiring for data and analytics role across the levels from Associate Data Scientist to Director level for experience ranging from 0-15 years.

In addition to the base salary, this position may be eligible for performance-based incentives.

We offer a competitive total rewards package that includes comprehensive health and welfare benefits as well as employee assistance programs.
,",6,https://www.shine.com/jobs/oliver-wyman-data-scientist-data-and-analytics-dna-gurugram-india/mercer/16507986
Senior Data Scientist - Remote,Akamai,5 to 9 Yrs,Full time,"Does developing creative machine learning models addressing application security threats get your head churning 

Would you love the chance to do data science, for good 

Join our Global Web Security group

Our team is part of the Cloud Security organization, responsible for the technologies powering Akamai's security products and protecting some of the world's major internet brands. Working in partnership with other development teams, we design and create highly scalable solutions.

Shape internet security

As a Senior Data Scientist, you will use statistics/machine learning to develop security algorithms and research emerging threats. Youll develop tools to visualize and analyze their outputs. Our release cycle will allow taking research and infusing it into products to protect global brands. You'll enhance our products"" security measures by devising innovative detection methods and integrating them effectively.

As a Senior Data Scientist, you will be responsible for:
 Leading the end-to-end development of data science projects, from prototyping to productization, in collaboration with project stakeholders.
 Developing new product features using statistical/machine learning-based algorithms to identify bot and fraud traffic
 Enhancing processes to collect, manipulate, present, and analyze large datasets, ensuring scalability and efficiency.
 Mentoring and guiding junior data scientists.

Do what you love

To be successful in this role you will:
 Have 5 years of relevant experience and a Bachelor's degree or equivalent work experience.
 Demonstrate a track record of leading projects to successful completion and enthusiasm for mentoring and guiding data science teams.
 Love digging into large datasets to identify creative ways of detecting fraud and bot traffic, showcasing innovative problem-solving skills.
 Possess knowledge of probability, statistics, and machine learning algorithms/techniques, especially in security or fraud context.

Work in a way that works for you

FlexBase, Akamais Global Flexible Working Program, is based on the principles that are helping us create the best workplace in the world. When our colleagues said that flexible working was important to them, we listened. We also know flexible working is important to many of the incredible people considering joining Akamai. FlexBase, gives 95% of employees the choice to work from their home, their office, or both (in the country advertised). This permanent workplace flexibility program is consistent and fair globally, to help us find incredible talent, virtually anywhere. We are happy to discuss working options for this role and encourage you to speak with your recruiter in more detail when you apply.

Learn what makes Akamai a great place to work

Connect with us on social and see what life at Akamai is like!

We power and protect life online, by solving the toughest challenges, together.

At Akamai, were curious, innovative, collaborative and tenacious. We celebrate diversity of thought and we hold an unwavering belief that we can make a meaningful difference. Our teams use their global perspectives to put customers at the forefront of everything they do, so if you are people-centric, youll thrive here.

Working for you

At Akamai, we will provide you with opportunities to grow, flourish, and achieve great things. Our benefit options are designed to meet your individual needs for today and in the future. We provide benefits surrounding all aspects of your life:
 Your health
 Your finances
 Your family
 Your time at work
 Your time pursuing other endeavors

Our benefit plan options are designed to meet your individual needs and budget, both today and in the future.

About us

Akamai powers and protects life online. Leading companies worldwide choose Akamai to build, deliver, and secure their digital experiences  helping billions of people live, work, and play every day. With the worlds most distributed compute platform  from cloud to edge  we make it easy for customers to develop and run applications, while we keep experiences closer to users and threats farther away.

Join us

Are you seeking an opportunity to make a real difference in a company with a global reach and exciting services and clients  Come join us and grow with a team of people who will energize and inspire you!

#LI-Remote,",6,https://www.shine.com/jobs/senior-data-scientist-remote/akamai/16509619
Senior Data Scientist,mindcurv group,3 to 7 Yrs,Full time,"Data Scientist ::

Experience :: 4+yrs

Notice Period :: Immediate

Location :: Kochi, Trivandrum , Coimbatore

About Mindcurv

We help our customers rethink their digital business, experiences, and technology to navigate the new digital reality. We do this by designing sustainable and accountable solutions for humans living in a digital world. Mindcurv holistically covers the markets need to digitalise business processes and customer experiences and take advantage of the cloud following DevOps and agile principles. We cater to the following six solution lines:
 Strategy and Advisory
 Creative Services and Digital Products
 Client Engagement Platforms
 Digital Experience and Solutions
 Data Services
 Cloud Platforms and Managed Services

We are made up of a team of experts from various domains that define, create, and improve digital experiences. They engage with people to achieve solutions that enable businesses to grow and scale sustainably.

Within our Cloud Platforms Solution Line, we apply an agile approach to provide true on-demand cloud platforms. We implement and operate secure cloud and hybrid global infrastructures using automation techniques for our clients business critical application landscape

Your role

The person is expected to be hands-on to deliver Data Science projects undertaken in the advanced analytics space. They must have a proven ability to drive business results with their data-based insights. They must be comfortable working with a wide range of stakeholders and functional/tech teams. The right candidate will have a passion for discovering solutions hidden in large data sets and working with stakeholders to improve business outcomes.
 Have experience working as a Data scientist in the context of Marketing (must have)
 Have worked in delivering use cases for the Automotive sector (good to have)
 Identify valuable data sources and collection processes
 Supervise preprocessing of structured and unstructured data
 Analyze large amounts of information to discover trends and patterns
 Build ML models using various machine-learning algorithms
 Present information using data visualization techniques
 Collaborate with Data engineering and product development teams
 Hands-on knowledge of implementing various AI algorithms and best-fit scenarios.
 Who you are
 3-5 years experience in Analytics systems/program delivery. At least 2 Big Data or Advanced Analytics project implementation experience
 Hands-on experience in Python. Knowledge of R, Pyspark and SQL is an added bonus.
 Knowledge of a variety of machine learning techniques (clustering, decision tree learning, artificial neural networks, etc.) and their real-world advantages/drawbacks
 Knowledge of advanced statistical techniques and concepts (regression, properties of distributions, statistical tests and proper usage, etc.) and experience with applications.
 Hands-on experience in the GCP/AWS/Azure platform (3+ years).
 Experience using business intelligence tools (e.g. Tableau) and Ml frameworks
 Strong math skills (e.g. statistics, algebra)
 Excellent communication and presentation skills,",4,https://www.shine.com/jobs/senior-data-scientist/mindcurv-group/16522611
"Principal Consultant, Research Data Scientist",Genpact,5 to 9 Yrs,Full time,"Genpact (NYSE: G) is a global professional services and solutions firm delivering outcomes that shape the future. Our 125,000+ people across 30+ countries are driven by our innate curiosity, entrepreneurial agility, and desire to create lasting value for clients. Powered by our purpose  the relentless pursuit of a world that works better for people  we serve and transform leading enterprises, including the Fortune Global 500, with our deep business and industry knowledge, digital operations services, and expertise in data, technology, and AI.

Inviting applications for the role of Principal Consultant, Research Data Scientist!

In this role, we are looking for candidates who have relevant years of experience in Text Mining / Natural Language Processing (NLP) tools, Data sciences, Big Data and algorithms.

Full cycle experience desirable in atleast 1 Large Scale Text Mining/NLP project from creating a Business use case, Text Analytics assessment/roadmap, Technology & Analytic Solutioning, Implementation and Change Management, considerable experience in Hadoop including development in map-reduce framework. The Text Mining Scientist (TMS) is expected to play a pivotal bridging role between enterprise database teams, and business /functional resources. At a broad level, the TMS will leverage his/her solutioning expertise to translate the customers business need into a techno-analytic problem and appropriately work with database teams to bring large scale text analytic solutions to fruition. The right candidate should have prior experience in developing text mining and NLP solutions using open source tools.

Responsibilities
 Develop transformative AI/ML solutions to address our clients"" business requirements and challenges
 Project Delivery - This would entail successful delivery of projects involving data Pre-processing, Model Training and Evaluation, Parameter Tuning
 Manage Stakeholder/Customer Expectations
 Project Blue Printing and Project Documentation
 Creating Project Plan
 Understand and research cutting edge industrial and academic developments in AI/ML with NLP/NLU applications in diverse industries such as CPG, Finance etc.
 Conceptualize, Design, build and develop solution algorithms which demonstrate the minimum required functionality within tight timelines
 Interact with clients to collect, synthesize, and propose requirements and create effective analytics/text mining roadmap.
 Work with digital development teams to integrate and transform these algorithms into production quality applications
 Do applied research on a wide array of text analytics and machine learning projects, file patents and publish the papers

Qualifications we seek in you!

Minimum Qualifications / Skills
 MS in Computer Science, Information systems, or Computer engineering
 Systems Engineering with relevant experience in Text Mining / Natural Language Processing (NLP) tools, Data sciences, Big Data and algorithms

Technology
 Open Source Text Mining paradigms such as NLTK, OpenNLP, OpenCalais, StanfordNLP, GATE, UIMA, Lucene, and cloud based NLU tools such as DialogFlow, MS LUIS
 Exposure to Statistical Toolkits such as R, Weka, S-Plus, Matlab, SAS-Text Miner
 Strong Core Java experience in large scale product development and functional knowledge of RDBMs
 Hands on to programing in the Hadoop ecosystem, and concepts in distributed computing
 Very good python/R programming skills. Java programming skills a plus

Methodology
 Solutioning & Consulting experience in verticals such as BFSI, CPG, with experience in delivering text analytics on large structured and unstructured data
 A solid foundation in AI Methodologies like ML, DL, NLP, Neural Networks, Information Retrieval and Extraction, NLG, NLU
 Exposed to concepts in Natural Language Processing & Statistics, esp., in their application such as Sentiment Analysis, Contextual NLP, Dependency Parsing, Parsing, Chunking, Summarization, etc
 Demonstrated ability to Conduct look-ahead client research with focus on supplementing and strengthening the clients analytics agenda with newer tools and techniques

Preferred Qualifications/ Skills

Technology
 Expert level of understanding of NLP, NLU and Machine learning/Deep learning methods
 OpenNLP, OpenCalais, StanfordNLP, GATE, UIMA, Lucene, NoSQL
 UI development paradigms that would enable Text Mining Insights Visualization, e.g., Adobe Flex Builder, HTML5, CSS3
 Linux, Windows, GPU Experience
 Spark, Scala for distributed computing
 Deep learning frameworks such as TensorFlow, Keras, Torch, Theano

Methodology
 Social Network modeling paradigms, tools & techniques
 Text Analytics using Natural Language Processing tools such as Support Vector Machines and Social Network Analysis
 Previous experience with Text analytics implementations, using open source packages and or SAS-Text Miner
 Ability to Prioritize, Consultative mindset & Time management skills



JobPrincipal Consultant

Primary LocationIndia-Gurugram

ScheduleFull-time

Education LevelMaster's / Equivalent

Job PostingOct 4, 2024, 12:27:03 PM

Unposting DateOngoing

Master Skills ListDigital

Job CategoryFull Time,",6,https://www.shine.com/jobs/principal-consultant-research-data-scientist/genpact/16510070
"Senior Principal Consultant, Research Data Scientist",Genpact,5 to 9 Yrs,Full time,"Genpact (NYSE: G) is a global professional services and solutions firm delivering outcomes that shape the future. Our 125,000+ people across 30+ countries are driven by our innate curiosity, entrepreneurial agility, and desire to create lasting value for clients. Powered by our purpose  the relentless pursuit of a world that works better for people  we serve and transform leading enterprises, including the Fortune Global 500, with our deep business and industry knowledge, digital operations services, and expertise in data, technology, and AI.

Inviting applications for the role of Senior Principal Consultant, Research Data Scientist!

In this role, we are looking for candidates who have relevant years of experience in Text Mining / Natural Language Processing (NLP) tools, Data sciences, Big Data and algorithms.

Full cycle experience desirable in atleast 1 Large Scale Text Mining/NLP project from creating a Business use case, Text Analytics assessment/roadmap, Technology & Analytic Solutioning, Implementation and Change Management, considerable experience in Hadoop including development in map-reduce framework. The Text Mining Scientist (TMS) is expected to play a pivotal bridging role between enterprise database teams, and business /functional resources. At a broad level, the TMS will leverage his/her solutioning expertise to translate the customers business need into a techno-analytic problem and appropriately work with database teams to bring large scale text analytic solutions to fruition. The right candidate should have prior experience in developing text mining and NLP solutions using open source tools.

Responsibilities
 Develop transformative AI/ML solutions to address our clients"" business requirements and challenges
 Project Delivery - This would entail successful delivery of projects involving data Pre-processing, Model Training and Evaluation, Parameter Tuning
 Manage Stakeholder/Customer Expectations
 Project Blue Printing and Project Documentation
 Creating Project Plan
 Understand and research cutting edge industrial and academic developments in AI/ML with NLP/NLU applications in diverse industries such as CPG, Finance etc.
 Conceptualize, Design, build and develop solution algorithms which demonstrate the minimum required functionality within tight timelines
 Interact with clients to collect, synthesize, and propose requirements and create effective analytics/text mining roadmap.
 Work with digital development teams to integrate and transform these algorithms into production quality applications
 Do applied research on a wide array of text analytics and machine learning projects, file patents and publish the papers

Qualifications we seek in you!

Minimum Qualifications / Skills
 MS in Computer Science, Information systems, or Computer engineering
 Systems Engineering with relevant experience in Text Mining / Natural Language Processing (NLP) tools, Data sciences, Big Data and algorithms

Technology
 Open Source Text Mining paradigms such as NLTK, OpenNLP, OpenCalais, StanfordNLP, GATE, UIMA, Lucene, and cloud based NLU tools such as DialogFlow, MS LUIS
 Exposure to Statistical Toolkits such as R, Weka, S-Plus, Matlab, SAS-Text Miner
 Strong Core Java experience in large scale product development and functional knowledge of RDBMs
 Hands on to programing in the Hadoop ecosystem, and concepts in distributed computing
 Very good python/R programming skills. Java programming skills a plus

Methodology
 Solutioning & Consulting experience in verticals such as BFSI, CPG, with experience in delivering text analytics on large structured and unstructured data
 A solid foundation in AI Methodologies like ML, DL, NLP, Neural Networks, Information Retrieval and Extraction, NLG, NLU
 Exposed to concepts in Natural Language Processing & Statistics, esp., in their application such as Sentiment Analysis, Contextual NLP, Dependency Parsing, Parsing, Chunking, Summarization, etc
 Demonstrated ability to Conduct look-ahead client research with focus on supplementing and strengthening the clients analytics agenda with newer tools and techniques

Preferred Qualifications/ Skills

Technology
 Expert level of understanding of NLP, NLU and Machine learning/Deep learning methods
 OpenNLP, OpenCalais, StanfordNLP, GATE, UIMA, Lucene, NoSQL
 UI development paradigms that would enable Text Mining Insights Visualization, e.g., Adobe Flex Builder, HTML5, CSS3
 Linux, Windows, GPU Experience
 Spark, Scala for distributed computing
 Deep learning frameworks such as TensorFlow, Keras, Torch, Theano

Methodology
 Social Network modeling paradigms, tools & techniques
 Text Analytics using Natural Language Processing tools such as Support Vector Machines and Social Network Analysis
 Previous experience with Text analytics implementations, using open source packages and or SAS-Text Miner
 Ability to Prioritize, Consultative mindset & Time management skills



JobSenior Principal Consultant

Primary LocationIndia-Noida

ScheduleFull-time

Education LevelMaster's / Equivalent

Job PostingOct 7, 2024, 10:46:40 AM

Unposting DateOngoing

Master Skills ListDigital

Job CategoryFull Time,",4,https://www.shine.com/jobs/senior-principal-consultant-research-data-scientist/genpact/16520922
